{
  "schemaVersion": 1,
  "entrySkill": "deliver-change",
  "specializations": {
    "processChange": "process-improve",
    "productionEngineering": "production-engineering"
  },
  "states": [
    {
      "id": "unregistered",
      "ownerSkill": "change-start",
      "commands": ["change start"],
      "transitions": [
        {"result": "success", "nextState": "specified", "nextSkill": "change-plan"}
      ]
    },
    {
      "id": "specified",
      "ownerSkill": "change-plan",
      "commands": ["change plan"],
      "transitions": [
        {"result": "success", "nextState": "planned", "nextSkill": "change-implement"}
      ]
    },
    {
      "id": "planned",
      "ownerSkill": "change-implement",
      "commands": ["change implement"],
      "transitions": [
        {"result": "success", "nextState": "implementing", "nextSkill": "change-verify"}
      ]
    },
    {
      "id": "implementing",
      "ownerSkill": "change-verify",
      "commands": ["change implement", "change verify"],
      "transitions": [
        {"result": "profile-passed", "nextState": "implementing", "nextSkill": "change-verify"},
        {"result": "all-passed", "nextState": "verified", "nextSkill": "change-review"}
      ]
    },
    {
      "id": "verified",
      "ownerSkill": "change-review",
      "commands": ["change implement", "change review start"],
      "transitions": [
        {"result": "assigned", "nextState": "review-pending", "nextSkill": "change-review"},
        {"result": "source-changed", "nextState": "implementing", "nextSkill": "change-implement"}
      ]
    },
    {
      "id": "review-pending",
      "ownerSkill": "change-review",
      "commands": ["change implement", "change review submit"],
      "transitions": [
        {"result": "approved", "nextState": "approved", "nextSkill": "change-complete"},
        {"result": "changes-requested", "nextState": "changes-requested", "nextSkill": "change-implement"},
        {"result": "source-changed", "nextState": "implementing", "nextSkill": "change-implement"}
      ]
    },
    {
      "id": "changes-requested",
      "ownerSkill": "change-implement",
      "commands": ["change implement"],
      "transitions": [
        {"result": "success", "nextState": "implementing", "nextSkill": "change-verify"}
      ]
    },
    {
      "id": "approved",
      "ownerSkill": "change-complete",
      "commands": ["change finish", "change implement"],
      "transitions": [
        {"result": "success", "nextState": null, "nextSkill": null},
        {"result": "source-changed", "nextState": "implementing", "nextSkill": "change-implement"}
      ]
    },
    {
      "id": "blocked",
      "ownerSkill": "deliver-change",
      "commands": [],
      "transitions": []
    }
  ]
}
